,titles,links,dates,contents
9,[새벽배송 시장 재편되나…유통강자 백기·네이버는 확대],https://www.khan.co.kr/economy/economy-general/article/202207261605001,2022.07.26 16:05,"[새벽배송 시장에 지각변동이 일어나고 있다. 그동안 노력해온 유통 강자들이 출혈경쟁에 따른 수익성 악화로 잇따라 새벽배송 사업을 접는 반면, 올 하반기부터는 네이버가 본격 가세한다. 여기에 더해 정부가 규제를 폐지할 경우 대형마트가 새로운 경쟁자로 진입해 새벽배송 시장이 재편될 가능성도 크다., GS리테일은 온라인 장보기 플랫폼 GS프레시몰이 제공하는 새벽 배송 서비스를 오는 31일부터 종료한다고 26일 밝혔다. GS리테일은 지난해 GS홈쇼핑과 통합 후 매출 기준으로 신세계·롯데를 잇는 국내 3위의 유통기업이다. 서비스 중단으로 새벽배송 상품 주문은 오는 30일 오후 11시까지만 이용할 수 있다., GS리테일은 선택과 집중을 통해 고객 만족도를 높이고 회사의 손익 개선에 기여할 수 있을 것이라고 판단했다. GS리테일 관계자는 “배송 체계의 효율성을 높이고 소비자들이 많이 찾는 당일배송에 집중해 멤버십 회원의 무료 배송 혜택을 강화하겠다”고 말했다., 밀키트 1위 기업인 프레시지도 이날 새벽배송을 중단했다. 프레시지는 “여러 인수합병(M&A)으로 상품 취급량이 늘어 자사몰 개편 작업에 집중하기 위해 비중이 낮은 일부 서비스를 중단한다”고 설명했다., 롯데쇼핑 통합 온라인몰 롯데온과 편의점 CU의 지주사인 BGF도 지난 5월 새벽배송을 접었다. 양사는 출혈경쟁에 물류비 상승까지 더해져 포스트 코로나로 접어든 시점에 맞춰 사업을 철수했다., 유통업체들이 잇따라 새벽배송을 접는 것은 고비용 구조로 흑자를 내지 못한 채로 더 버티기 어려워서다. 새벽배송은 인건비가 주간배송보다 2배 가량 높고, 냉장·냉동 배송시스템 등 자체 물류 인프라 구축으로 초기에 대규모 투자 비용이 들어간다. 이로 인해 새벽배송 서비스를 제공하는 업체들은 매해 적자를 감수하고 있다. 새벽배송으로 흑자를 내는 곳은 오아시스 마켓(새벽배송 전문기업)이 유일하다., 홈쇼핑 업체까지 뛰어들어 경쟁이 심화하는 새벽배송 시장은 성장세다. 교보증권에 따르면 국내 시장 규모가 2020년 2조5000억원에서 올해 11조9000억원으로 5배 가량 성장할 것으로 전망된다. 코로나19를 계기로 온라인 신선식품 구매를 꺼리던 4050세대까지 새벽배송을 경험하며 구매 패턴이 바뀐 점이 영향을 끼쳤다., 이에 올해 3월 SSG닷컴(신세계그룹 통합 온라인몰)과 손잡고 신선식품 새벽배송 시장에 뛰어든 네이버는 하반기부터 상품군을 넓히며 본격적으로 나선다. 네이버는 수익성 확보가 어려운 점을 감안해  협업전략을 취했다. 포털을 기반으로 국내 최대 규모의 활성 회원을 보유한 네이버는 SSG닷컴·CJ대한통운과 협업을 택해 새벽배송 시장 재편에 영향을 끼칠지 관심이 쏠린다., 또한 대형마트의 새벽배송 허용 여부도 변수다. 공정거래위원회는 대형마트 휴업일에 배송까지 제한하는 것은 소비자 편익을 저해하는 과도한 규제로 보고 산업통상자원부와 규제 개선 논의를 시작했다. 규제가 풀리면 대형마트는 전국의 오프라인 점포를 물류센터로 활용해 별도 투자 없이 새벽배송에 나설 수 있다., 대형마트 관계자는 “신선식품에 대한 온라인 침투율이 상대적으로 낮고 새벽배송이 수도권에 제한돼 있어 여전히 늘어날 수요가 많다”며 “지방의 오프라인 점포를 물류 인프라로 활용하면 전국 단위의 새벽배송으로 고객 혜택을 확대할 수 있어 정부 논의를 예의주시하고 있다”고 말했다.]"
0,[새벽배송 ‘1호 상장사’ 주인공은 누가 될까?],https://www.khan.co.kr/economy/economy-general/article/202110312136055,2021.10.31 21:36,"[마켓컬리·SSG닷컴·오아시스마켓내년 국내 증시 상장을 목표로대표 주간사 선정 잇따라 완료, ‘새벽배송’을 대표하는 기업들이 최근 경쟁적으로 상장 절차에 돌입하면서 ‘1호 상장사’ 타이틀을 누가 거머쥘지 관심이 쏠리고 있다. 상장에 성공하면 풍부한 자금을 바탕으로 시장 점유율 경쟁에서 속도를 낼 수 있다. 이른바 ‘새벽배송 빅3’ 기업인 마켓컬리와 SSG닷컴, 오아시스마켓은 최근 상장 주간사를 결정짓는 등 2022년을 목표로 기업공개(IPO) 준비에 한창이다., 31일 유통업계에 따르면 새벽배송 1위 기업 마켓컬리는 지난 29일 NH투자증권·한국투자증권·JP모간을 대표 주간사로 선정했다. 앞서 이마트 계열사인 SSG닷컴은 미래에셋증권과 씨티그룹글로벌마켓증권을, e커머스 중 유일한 흑자 기업인 오아시스마켓은 한국투자증권과 NH투자증권을 대표 주간사로 선정했다., SSG닷컴은 이마트의 이베이코리아 인수 등 신세계그룹의 디지털 전환 사업에 맞춰 당초 2023년이었던 상장 목표를 2022년으로 앞당겼다. 미국 상장을 검토하던 마켓컬리는 한국거래소가 유가증권시장(코스피) 상장 규정을 완화하자 지난 7월 국내 상장으로 방향을 틀었다. 오아시스마켓은 지난해 8월 일찌감치 상장 주간사를 선임했다., 절대 강자가 없는 e커머스 시장에서 살아남으려면 전국 물류 인프라 설립을 위한 자금확보가 시급하다. 현재 새벽배송은 수도권과 충청권 등에서만 가능하다. 쿠팡 같은 종합 e커머스와 대기업들이 신선식품에 대한 투자를 늘려 신선식품 시장이 유통업계의 최대 격전지로 떠오른 것도 부담거리다., 새벽배송 기업들은 ‘1호 상장’ 자리를 두고 외형 확장에 힘을 주고 있다. 3사 모두 비식품 상품 판매를 늘리고 오픈마켓을 도입했다. 상품군을 확대해 거래액을 늘리기 위한 전략이다. 오픈마켓은 판매자가 온라인 플랫폼에 모여 상품을 파는 곳으로, 모든 책임을 판매자가 진다. 위험부담이 있지만 온라인 플랫폼은 단기간에 거래액을 늘려 덩치를 키울 수 있다., 3사 모두 비식품 상품 판매 늘리고오픈마켓 도입 등 외형 확장 나서쿠팡과 대기업들의 경쟁 가세 속상장 땐 인프라 넓힐 자금 확보, 3사 중 기업 규모가 가장 큰 곳은 SSG닷컴이다. 금융투자업계에서는 SSG닷컴의 기업가치를 10조원대로 보고 있다. SSG닷컴은 상장 출사표를 통해 지난해 말 기준 1조4000억원의 자본 총계를 기록해 법인 출범 이래 관리 가능한 수준의 손익을 유지하고 있다고 설명했다. SSG닷컴 관계자는 “대부분 자본 잠식 상태로 매년 수천억원의 적자를 기록하는 경쟁사들과 차별화되는 요인”이라고 말했다., 마켓컬리는 한국거래소가 K-유니콘 거래소 유치를 위해 올해 4월 발표한 신규 방식으로 상장을 추진한다. 예정대로 내년 상반기 거래소 입성에 성공하면 K-유니콘 1호 기업이 된다. 금융투자업계는 마켓컬리의 기업가치를 5조~7조원대로 보고 있다. 마켓컬리 관계자는 자본잠식 우려 등에 대해 “회계장부상 우선주 관련 평가손실 등의 요인으로 현재는 자본잠식 상태로 표기되지만, 우선주는 상장과정에서 보통주로 전환되고 자본 총계도 흑자로 전환될 것”이라고 말했다., 오아시스마켓은 상장 주간사로부터 각각 50억원씩 총 100억원 규모의 투자를 유치하면서 1조원의 기업가치를 인정받아 유니콘에 등극했다. 오아시스마켓은 실적을 공개하기 시작한 2015년부터 지난해까지 흑자를 이어왔다. 오아시스마켓 관계자는 “새벽배송 기업 중 유일하게 흑자를 기록하며 탄탄한 재무구조를 갖고 있는 곳으로 내실을 기하는 지속 가능한 e커머스가 될 것”이라고 말했다.]"
1,"[“노동자 짜내는 ‘21세기 평화시장’ 물류센터, 불안정 노동이 핵심”]",https://www.khan.co.kr/national/national-general/article/202208171640011,2022.08.17 16:40,"[“현대판 막장” “21세기 평화시장”…, ‘새벽배송’으로 대표되는 이커머스 업체들의 물류센터 노동자들이 스스로의 처지를 자조하는 말이다. 이들이 처한 위험은 복합적이다. 코로나19를 타고 산업이 급속도로 성장했지만, 성장의 과실은 노동자 보호보다는 ‘더 많은 확장’에 투입되고 있다. 노동자들은 안전사고와 화재, 장시간·고강도 노동, 고무줄 노동시간과 노동인권 침해 등에 시달리게 됐다., 물류센터 노동자들의 열악한 처우를 해결하기 위해 제도적 통제가 필요하다는 지적이 나왔다. 위험에 제대로 대응하지 못하게 하는 불안정한 고용구조를 바로잡고, 장시간 노동과 시설 안전에 관한 규제를 강화해야 한다는 것이다. 장귀연 전국불안정노동철폐연대 노동권연구소장 등 전문가들은 17일 오후 류호정·이은주 정의당 의원실 주최로 국회에서 열린 ‘물류센터 노동자 노동인권 상황과 개선방안 마련을 위한 토론회’에 참석해 이 같은 문제의식을 공유했다., 이커머스 산업은 온라인 쇼핑 환경 발전과 코로나19가 맞물리면서 급속도로 성장했다. 이에 따라 물류센터도 단순한 보관 창고가 아니라 입고와 재고관리, 포장, 배송 등 물류 과정 전반을 수행하게 됐다. 또 당일배송·심야배송 등서비스가 확산되고 소비자들이 이에 익숙해지면서 업계 전반의 배송 속도가 빨라지게 됐다., 물류량이 늘고 업무 속도가 빨라지면서 ‘짜내기 노동’의 우려가 커졌다. 장 소장은 “물류센터에서 수행되는 상하차 등 업무는 극도로 열악한 노동환경과 살인적인 노동강도로 유명하다”며 “일할 사람을 구하기 어렵기 때문에 자동화를 추구하지만, 설비 도입 가격이 높아서 현장에서는 여전히 작업자의 노동력을 극단적으로 추출하는 방식이 주를 이루고 있다”고 했다., 물류센터가 대형화·복잡화되면서 화재 위험도 늘었다. 전주희 서교인문사회연구실 연구원은 “(물류센터 대형화·복잡화로)내부에 많은 물건이 적재돼 있을 뿐만 아니라, 컨베이어벨트와 같은 설비가 설치되어 있는 경우가 늘고 있다”며 “또 기본적으로 ‘물건을 쌓아두는 공간’이라는 관념 때문에 일반 건축물에 비해 값싸고 화재에 취약한 가연성 소재를 사용하고, 저온창고 등 커다란 냉장고의 밀폐형 구조는 더욱 위험하다”고 했다., 특히 노동자들의 불안정한 고용구조가 위험을 키운다. 물류센터 노동자들은 직접고용이라도 ‘쪼개기 계약’을 중심으로 한 계약직이 대부분이고, 간접고용의 경우 도급이나 인력업체를 통한 일용직이 많다. 장시간·고강도 노동에 목소리를 내기는커녕 산재신청조차 눈치를 볼 수밖에 없는 구조다., 장 소장은 “고용이 불안정하기 때문에 일을 할 수 있을 때 최대한 많이 일해 소득을 올려야 한다고 생각하거나, 노동강도를 최대화하지 않으면 다음 고용이나 재계약에 불리할지도 모른다고 생각해 (장시간·고강도 노동을)감내하는 것”이라고 했다. 전 연구원은 “일하다 아프거나 다치는 경우 대부분 산재신청을 하지 않고 비공식적으로 처리한다”며 “고용상의 불안정 때문에 노동자가 스스로 산재신청을 체념하고 있다”고 했다., 노동자가 스스로 노동환경 개선을 위해 나서기도 어렵다. 관리자들의 눈 밖에 나면 다음 계약이나 출근을 담보하기도 쉽지 않다. 쿠팡에 휴게시간·에어컨 설치 등을 요구하던 중 계약해지를 당한 정성용 공공운수노조 전국물류센터지부 쿠팡물류센터지회 인천분회장은 “휴게시간과 냉난방 장치 관련 서명에 많은 이들이 서명해줬지만 어떤 분들은 이름을 적는 데 불안해하기도 했다. 특히 최근 들어 노조 간부에 대한 노골적인 해고가 벌어지고 있다”며 “일부 센터에서 휴게시간이나 갑질 완화 등 성과가 있었지만, 노조가 없는 센터는 이전의 문제들이 똑같다고 한다”고 했다., 전문가들은 고용구조부터 노동시간·강도, 불법노동행위 감시 강화 등 복합적인 대책을 주문했다. 문은영 민주사회를위한변호사모임 노동위원회 변호사는 “파견법 적용을 폐지하고, 계약형태나 고용형태와 관계없이 일하는 사람에 대한 원사용자의 책임을 부과해야 한다”며 “야간노동을 규제하는 법령을 신설하고 노동시간 특례업종에서 물류산업 적용을 제외하고 작업거부권을 보장하는 방향으로 제도개선을 추진해야 한다”고 했다. 이어 “근로감독 강화와 더불어 노동자 개개인에게 임금 내역을 자세히 고지해야 한다”며 “생활물류서비스법에 휴식시간과 공간, 연속노동시간 규제 등을 구체적으로 포함해야 한다”고 했다.<시리즈 끝>]"
2,[새벽배송 시장 재편되나…유통강자 백기·네이버는 확대],https://www.khan.co.kr/economy/economy-general/article/202207261605001,2022.07.26 16:05,"[새벽배송 시장에 지각변동이 일어나고 있다. 그동안 노력해온 유통 강자들이 출혈경쟁에 따른 수익성 악화로 잇따라 새벽배송 사업을 접는 반면, 올 하반기부터는 네이버가 본격 가세한다. 여기에 더해 정부가 규제를 폐지할 경우 대형마트가 새로운 경쟁자로 진입해 새벽배송 시장이 재편될 가능성도 크다., GS리테일은 온라인 장보기 플랫폼 GS프레시몰이 제공하는 새벽 배송 서비스를 오는 31일부터 종료한다고 26일 밝혔다. GS리테일은 지난해 GS홈쇼핑과 통합 후 매출 기준으로 신세계·롯데를 잇는 국내 3위의 유통기업이다. 서비스 중단으로 새벽배송 상품 주문은 오는 30일 오후 11시까지만 이용할 수 있다., GS리테일은 선택과 집중을 통해 고객 만족도를 높이고 회사의 손익 개선에 기여할 수 있을 것이라고 판단했다. GS리테일 관계자는 “배송 체계의 효율성을 높이고 소비자들이 많이 찾는 당일배송에 집중해 멤버십 회원의 무료 배송 혜택을 강화하겠다”고 말했다., 밀키트 1위 기업인 프레시지도 이날 새벽배송을 중단했다. 프레시지는 “여러 인수합병(M&A)으로 상품 취급량이 늘어 자사몰 개편 작업에 집중하기 위해 비중이 낮은 일부 서비스를 중단한다”고 설명했다., 롯데쇼핑 통합 온라인몰 롯데온과 편의점 CU의 지주사인 BGF도 지난 5월 새벽배송을 접었다. 양사는 출혈경쟁에 물류비 상승까지 더해져 포스트 코로나로 접어든 시점에 맞춰 사업을 철수했다., 유통업체들이 잇따라 새벽배송을 접는 것은 고비용 구조로 흑자를 내지 못한 채로 더 버티기 어려워서다. 새벽배송은 인건비가 주간배송보다 2배 가량 높고, 냉장·냉동 배송시스템 등 자체 물류 인프라 구축으로 초기에 대규모 투자 비용이 들어간다. 이로 인해 새벽배송 서비스를 제공하는 업체들은 매해 적자를 감수하고 있다. 새벽배송으로 흑자를 내는 곳은 오아시스 마켓(새벽배송 전문기업)이 유일하다., 홈쇼핑 업체까지 뛰어들어 경쟁이 심화하는 새벽배송 시장은 성장세다. 교보증권에 따르면 국내 시장 규모가 2020년 2조5000억원에서 올해 11조9000억원으로 5배 가량 성장할 것으로 전망된다. 코로나19를 계기로 온라인 신선식품 구매를 꺼리던 4050세대까지 새벽배송을 경험하며 구매 패턴이 바뀐 점이 영향을 끼쳤다., 이에 올해 3월 SSG닷컴(신세계그룹 통합 온라인몰)과 손잡고 신선식품 새벽배송 시장에 뛰어든 네이버는 하반기부터 상품군을 넓히며 본격적으로 나선다. 네이버는 수익성 확보가 어려운 점을 감안해  협업전략을 취했다. 포털을 기반으로 국내 최대 규모의 활성 회원을 보유한 네이버는 SSG닷컴·CJ대한통운과 협업을 택해 새벽배송 시장 재편에 영향을 끼칠지 관심이 쏠린다., 또한 대형마트의 새벽배송 허용 여부도 변수다. 공정거래위원회는 대형마트 휴업일에 배송까지 제한하는 것은 소비자 편익을 저해하는 과도한 규제로 보고 산업통상자원부와 규제 개선 논의를 시작했다. 규제가 풀리면 대형마트는 전국의 오프라인 점포를 물류센터로 활용해 별도 투자 없이 새벽배송에 나설 수 있다., 대형마트 관계자는 “신선식품에 대한 온라인 침투율이 상대적으로 낮고 새벽배송이 수도권에 제한돼 있어 여전히 늘어날 수요가 많다”며 “지방의 오프라인 점포를 물류 인프라로 활용하면 전국 단위의 새벽배송으로 고객 혜택을 확대할 수 있어 정부 논의를 예의주시하고 있다”고 말했다.]"
3,[출혈경쟁 속 성장세 이어왔지만 ‘새벽배송 시장’ 결국 새판 짠다],https://www.khan.co.kr/economy/economy-general/article/202207262218015,2022.07.26 22:18,"[수익성 악화 따라 일부 대기업 철수BGF‧롯데온 이어 GS리테일 ‘백기’빈자리엔 네이버, 하반기부터 가세, 온라인 구매 꺼리던 4050도 흡수시장 규모는 2년 새 5배 폭풍 성장대형마트 휴무일 배송 허용도 변수, 새벽배송 시장에 지각변동이 일어나고 있다. 그동안 시장의 강자로 통했던 유통업체들이 출혈경쟁에 따른 수익성 악화로 잇따라 새벽배송 사업을 접는데, 네이버는 올 하반기에 본격 가세한다. 여기에 더해 정부가 규제를 폐지할 경우 대형마트가 새로운 경쟁자로 진입해 새벽배송 시장이 재편될 가능성도 있다., GS리테일은 온라인 장보기 플랫폼 GS프레시몰이 제공하는 새벽배송 서비스를 오는 31일 종료한다고 26일 밝혔다. GS리테일은 지난해 GS홈쇼핑과 통합한 후 매출 기준으로 신세계·롯데에 이어 국내 3위의 유통기업이다. 서비스 중단으로 새벽배송 상품 주문은 오는 30일 오후 11시까지만 이용할 수 있다., GS리테일은 선택과 집중을 통해 고객 만족도를 높이고 회사의 손익 개선에 기여할 수 있을 것이라고 판단했다. GS리테일 관계자는 “배송 체계의 효율성을 높이고 소비자들이 많이 찾는 당일배송에 집중해 멤버십 회원의 무료 배송 혜택을 강화하겠다”고 말했다. 이와 함께 밀키트 1위 기업인 프레시지도 이날 새벽배송을 중단했다., 롯데쇼핑 통합 온라인몰 롯데온과 편의점 CU의 지주사인 BGF도 지난 5월 새벽배송을 접었다. 양사는 출혈경쟁에 물류비 상승까지 더해져 위드 코로나로 접어든 시점에 맞춰 사업을 철수했다., 유통업체들이 잇따라 새벽배송을 접는 것은 고비용 구조로 흑자를 내지 못하면서 더 버티기 어려워서다. 새벽배송은 인건비가 주간배송보다 2배가량 높고, 냉장·냉동 배송시스템 등 자체 물류 인프라 구축으로 초기에 대규모 투자 비용이 들어간다. 이로 인해 새벽배송 서비스를 제공하는 업체들은 매해 적자를 감수하고 있다. 새벽배송으로 흑자를 내는 곳은 오아시스 마켓(새벽배송 전문기업)이 유일하다., 홈쇼핑 업체까지 뛰어들어 경쟁이 심화하고 있지만 새벽배송 시장은 성장세다. 교보증권에 따르면 국내 시장 규모가 2020년 2조5000억원에서 올해 11조9000억원으로 5배가량 성장할 것으로 전망된다. 코로나19를 계기로 온라인 신선식품 구매를 꺼리던 4050세대까지 새벽배송을 경험하며 구매 패턴이 바뀐 점이 영향을 끼쳤다., 이에 올해 3월 SSG닷컴(신세계그룹 통합 온라인몰)과 손잡고 신선식품 새벽배송 시장에 뛰어든 네이버는 하반기부터 상품군을 넓히며 본격적으로 나선다. 네이버는 수익성 확보가 어려운 점을 감안해 협업전략을 취했다. 포털을 기반으로 국내 최대 규모의 활성 회원을 보유한 네이버는 SSG닷컴·CJ대한통운과의 협업을 택해 새벽배송 시장 재편에 영향을 끼칠지 관심이 쏠린다., 대형마트의 새벽배송 허용 여부도 변수다. 공정거래위원회는 대형마트 휴업일에 배송까지 제한하는 것은 소비자 편익을 저해하는 과도한 규제로 보고 산업통상자원부와 규제 개선 논의를 시작했다. 규제가 풀리면 대형마트는 전국의 오프라인 점포를 물류센터로 활용해 별도 투자 없이 새벽배송에 나설 수 있다., 대형마트 관계자는 “신선식품에 대한 온라인 침투율이 상대적으로 낮고 새벽배송이 수도권에 제한돼 있어 여전히 늘어날 수요가 많다”며 “지방의 오프라인 점포를 물류 인프라로 활용하면 전국 단위의 새벽배송으로 고객 혜택을 확대할 수 있어 정부 논의를 예의주시하고 있다”고 말했다.]"
4,"[위상 높아진 플랫폼 대표들, 재벌 총수들과 ‘한자리에’]",https://www.khan.co.kr/economy/market-trend/article/202205102308025,2022.05.10 23:08,"[쿠팡·컬리·배민·왓챠·토스 등e커머스·OTT 대표들도 눈길재계 “성장 돕겠다는 정부 의지”, 10일 서울 여의도 국회에서 열린 윤석열 대통령 취임식에는 재계 대표로 주요 그룹 총수 외에 네이버, 카카오 등 디지털 플랫폼 대표들이 대거 참석했다., 과거에 비해 높아진 플랫폼 기업의 위상을 한눈에 볼 수 있는 장면이었다., 최수연 네이버 대표와 김성수 카카오 이사회 의장 등 플랫폼 기업 대표들은 이재용 삼성전자 부회장, 최태원 SK그룹 회장, 정의선 현대차그룹 회장, 구광모 LG그룹 회장, 신동빈 롯데그룹 회장 등 재벌 총수, 허창수 전국경제인연합회 회장 등 경제단체장들과 어깨를 나란히 했다., 강한승 쿠팡 대표와 김슬아 컬리(마켓컬리 운영사) 대표, 안준형 오아시스마켓 대표는 e커머스 플랫폼을 대표해 취임식에 참석했다., 쿠팡은 코로나19 시기 대규모 고용으로 일자리 창출에 기여한 점이 인수위원회에서 높은 평가를 받은 것으로 전해졌다., 배달 애플리케이션(앱) 대표로 김범준 우아한형제들(배달의민족 운영사) 대표, 국내 최초로 온라인동영상서비스(OTT)를 만든 박태훈 왓챠 대표, 이승건 비바리퍼블리카(토스 운영사) 대표, 안성우 직방 대표, 이수진 야놀자 대표도 취임식에 초대됐다. 대부분 최근 주요 플랫폼으로 성장한 업체들의 창업자다., 기업인들이 대통령 취임식에 참석한 것은 박근혜 정부가 출범한 2013년 2월 이후 9년 만이다., 2017년 문재인 전 대통령 취임 때는 당선 다음날 바로 취임을 하면서 외빈 초청 없이 약식으로 취임 선서를 진행했다., 9년 전엔 재계를 대표해 당시 정몽구 현대차그룹 회장, 구본무 LG그룹 회장, 조양호 한진그룹 회장, 정준양 포스코 회장 등이 대통령 취임식에 참석했다. 이건희 삼성전자 회장은 해외 일정으로 불참했다. 신생 기업 대표들은 초대받지 못했다., 재계 관계자는 “예전엔 취임식에 대기업 총수와 경제단체장 위주로 초대하는 게 관행이었다”고 말했다. 이 관계자는 “이번에 플랫폼기업 경영자들이 취임식에 참석한 것은 강하게 규제하기보다 성장하도록 돕겠다는 새 정부의 의지를 표현한 것으로 보인다”고 덧붙였다.]"
