,titles,links,dates,contents
5,[달라진 위상 실감…재벌총수들과 어깨 나란히 한 플랫폼 대표들],https://www.khan.co.kr/economy/market-trend/article/202205101553011,2022.05.10 15:53,"[10일 서울 여의도 국회에서 열린 윤석열 대통령 취임식에는 재계 대표로 주요 그룹 총수 외에 네이버, 카카오 등 디지털 플랫폼 대표들이 대거 참석했다. 과거에 비해 높아진 플랫폼 기업의 위상을 한 눈에 볼 수 있는 장면이었다., 최수연 네이버 대표와 김성수 카카오 이사회 의장 등 플랫폼 기업 대표들은 이재용 삼성전자 부회장, 최태원 SK그룹 회장(대한상공회의소 회장), 정의선 현대차그룹 회장, 구광모 LG그룹 회장, 신동빈 롯데그룹 회장 등 재벌 총수, 허창수 전국경제인연합회 회장 등 경제단체장들과 어깨를 나란히 했다., 강한승 쿠팡 대표와 김슬아 컬리(마켓컬리 운영사) 대표, 안준형 오아시스마켓 대표는 이커머스 플랫폼을 대표해 취임식에 참석했다. 쿠팡은 코로나19 시기 대규모 고용으로 일자리 창출에 기여한 점이 인수위원회에서 높은 평가를 받은 것으로 전해졌다. 배달앱 대표로 김범준 우아한형제들(배달의민족 운영사) 대표, 국내 최초로 온라인동영상서비스(OTT)를 만든 박태훈 왓챠 대표, 이승건 비바리퍼블리카(토스 운영사) 대표, 안성우 직방 대표, 이수진 야놀자 대표도 취임식에 초대됐다. 대부분 최근 주요 플랫폼으로 성장한 회사들의 창업자다., 기업인들이 대통령 취임식에 참석한 것은 박근혜 정부가 출범한 2013년 2월 이후 9년 만이다. 2017년 문재인 전 대통령 취임 때는 당선 다음날 바로 취임을 하면서 외빈 초청없이 약식으로 취임 선서를 진행했다., 9년 전엔 재계를 대표해 당시 정몽구 현대차그룹 회장, 구본무 LG그룹 회장, 조양호 한진그룹 회장, 정준양 포스코 회장 등이 대통령 취임식에 참석했다. 이건희 삼성전자 회장은 해외 일정으로 불참했다. 신생 기업 대표들은 초대받지 못했다., 재계 관계자는 “예전엔 취임식에 대기업 총수와 경제단체장 위주로 초대하는 게 관행이었다”며 “이번엔 전임 정부와 달리 플랫폼을 강하게 규제하기보다 성장하도록 돕겠다는 의지를 표현한 것으로 보인다”고 말했다.]"
6,[후발주자 잇단 참전…치열해진 새벽배송],https://www.khan.co.kr/economy/industry-trade/article/202203082308005,2022.03.08 23:08,"[네이버, SSG닷컴과 연계해 진출온라인몰인 G마켓·인터파크에CJ온스타일 등 홈쇼핑도 가세, 내년 시장규모 12조원 육박 전망기존 업체는 배송망·제품군 확대, 온라인 장보기 일상화로 신선식품 새벽배송 시장에 신규 사업자들이 잇따라 진출하고 있다. ‘IT공룡’ 네이버를 비롯해 온라인몰과 홈쇼핑 업체 등이 출사표를 내면서 새벽배송이 유통시장의 뉴노멀(새로운 기준)이 되는 분위기다. 기존 업체들은 새벽배송 지역을 전국으로 확대하고 취급 상품군도 늘리며 차별화에 나서고 있다., e커머스 시장 점유율 1위(17%) 사업자 네이버는 지난 3일 신세계그룹 통합 온라인몰 SSG닷컴과 함께 새벽배송 시장에 뛰어들었다., 네이버는 SSG닷컴 자동화 물류센터 네오를 통해 자정 안에 주문받은 상품은 다음날 오전 6시까지 배송한다. 소비자들은 아침 식사를 위한 찬거리나 베이커리 등 SSG푸드마켓에서 취급하는 먹거리 2만여종을 아침에 받을 수 있다., 비식품군이 주력이던 온라인몰과 홈쇼핑업체도 뛰어들었다. G마켓과 옥션을 운영하는 지마켓글로벌은 지난달 물류전문기업 메쉬코리아와 함께 유료 회원에게 새벽배송을 시작했다. 서울 강남 등 일부 지역에서 시범운영한 뒤 오는 24일부터 서울 전체 권역으로 서비스를 확대할 예정이다. 인터파크도 지난달 신선식품 전용관 ‘파머스파크’(Farmer’s park)를 열고 새벽배송 카테고리를 개설했다. 축·수산물을 오후 4시까지 주문하면 다음날 오전 7시까지 집 앞으로 배송해준다. 서비스 가능 지역은 서울·경기·인천이다., 홈쇼핑에서는 CJ온스타일과 NS홈쇼핑이 지난해 12월부터 수도권에서 가정간편식(HMR) 등을 새벽배송하고 있다. 축산물 유통 스타트업 정육각이 최근 인수한 유기농 식품 회사 초록마을도 새벽배송 시장 진출을 앞두고 있다. 공산품은 지난해 기준으로 온라인 침투율(전체 소비지출에서 온라인 거래가 차지하는 비중)이 50%를 넘은 데 반해 식품은 25%에 그쳤다. 온라인 식품 시장의 성장 잠재력이 그만큼 높다는 의미이기도 하다. 유통업계 관계자는 “식품은 고정적인 수요가 창출되는 품목이라 도전해야 하는 필수 시장이 됐다”며 “당장 수익으로 이어지지는 못해도 일단 신뢰를 얻으면 고객을 잡아두는 데 유리하고 시장 점유율 확대의 기회를 만들 수 있다”고 말했다., 교보증권은 새벽배송 시장이 2020년 2조5000억원 규모로 전년 대비 2배 이상 늘고, 2023년까지 11조9000억원 규모로 성장할 것으로 내다봤다. 정소연 교보증권 연구원은 “새벽배송은 장보기를 대체하는 가장 적합한 방식으로 식품의 메인 라스트마일(물품이 소비자에게 배송되는 마지막 단계)로 자리매김할 것”이라고 설명했다., 마켓컬리, SSG닷컴, 오아시스마켓 등 기존 신선식품 새벽배송 전문업체들은 배송을 전국으로 확대하고, 비식품군을 늘려 사업을 확장하고 있다. 유통업계에서는 경쟁 격화로 새벽배송의 차별점이 사라져 ‘콘텐츠’가 향후 성패를 가를 것으로 보고 있다., 새벽배송 전문업체 관계자는 “새벽배송 같은 빠른 배송 형태는 협업 등을 통해 누구나 가능해 졌다”며 “고객들이 원하는 맞춤 상품을 발굴해 질 좋은 상태로 지속가능하게 배송할 수 있는지가 관건이 될 것”이라고 말했다.]"
7,"[네이버·홈쇼핑 등 새벽배송 진출 러쉬…""온라인 장보기 접수""]",https://www.khan.co.kr/economy/economy-general/article/202203081559001,2022.03.08 15:59,"[온라인 장보기 일상화로 신선식품 새벽배송 시장에 신규 사업자들이 잇따라 진출하고 있다. ‘IT공룡’ 네이버를 비롯해 온라인몰과 홈쇼핑 업체 등이 출사표를 내면서 새벽배송이 유통시장의 뉴노멀(새로운 기준)이 되는 분위기다. 기존 업체들은 새벽배송 지역을 전국으로 확대하고 취급 상품군도 늘리며 차별화에 나섰다., e커머스 시장 점유율 1위(17%) 사업자 네이버는 지난 3일 신세계 그룹 통합 온라인몰 SSG닷컴과 함께 새벽배송 시장에 뛰어들었다. 네이버는 SSG닷컴 자동화 물류센터 네오를 통해 자정 안에 주문받은 상품은 다음날 오전 6시까지 배송한다. 소비자들은 아침 식사를 위한 찬거리나 베이커리 등 SSG푸드마켓에서 취급하는 먹거리 2만여종을 아침에 받을 수 있다., 비식품군이 주력이었던 온라인몰과 홈쇼핑업체도 뛰어들었다. G마켓과 옥션을 운영하는 지마켓글로벌은 지난달 물류전문기업 메쉬코리아와 함께 유료 회원에게 새벽배송을 시작했다. 서울 강남 등 일부 지역에서 시범운영한 뒤 오는 24일부터 서울 전체 권역으로 서비스를 확대할 예정이다. 인터파크도 지난달 신선식품 전용관 ‘파머스파크(Farmer’s park)’를 열고 새벽배송 카테고리를 개설했다. 축·수산물을 오후 4시까지 주문하면 다음날 오전 7시까지 집 앞으로 배송해준다. 서비스 가능 지역은 서울·경기·인천이다., 홈쇼핑에서는 CJ온스타일과 NS홈쇼핑이 지난해 12월부터 수도권에서 가정간편식(HMR) 등을 새벽배송하고 있다. 축산물 유통 스타트업 정육각이 최근 인수한 유기농 식품 회사 초록마을도 새벽배송 시장 진출을 앞두고 있다. 공산품은 작년 기준으로 온라인 침투율(전체 소비지출에서 온라인 거래가 차지하는 비중)이 50%를 넘은 데 반해 식품은 25%에 그쳤다. 온라인 식품 시장의 성장 잠재력이 그만큼 높다는 의미이기도 하다. 유통업계 관계자는 “식품은 고정적인 수요가 창출되는 품목이라 도전해야 하는 필수 시장이 됐다”며 “당장 수익으로 이어지지는 못해도 일단 신뢰를 얻으면 고객을 잡아두는 데 유리하고 시장 점유율 확대의 기회를 만들 수 있다”고 말했다., 교보증권은 새벽배송 시장이 2020년 2조5000억원 규모로 전년 대비 2배 이상 늘고, 2023년까지 11조9000억원 규모로 성장할 것으로 내다봤다. 정소연 교보증권 연구원은 “새벽배송은 장보기를 대체하는 가장 적합한 방식으로 식품의 메인 라스트마일(물품이 소비자에게 배송되는 마지막 단계)로 자리매김 할 것”이라고 설명했다., 마켓컬리, SSG닷컴, 오아시스마켓 등 기존 신선식품 새벽배송 전문업체들은 배송을 전국으로 확대하고, 비식품군을 늘려 사업을 확장하고 있다. 유통업계에서는 경쟁 격화로 새벽배송의 차별점이 사라져 ‘콘텐츠’가 향후 성패를 가를 것으로 보고 있다. 새벽배송 전문업체 관계자는 “새벽배송 등 빠른 배송 형태는 협업 등을 통해 누구나 가능해 졌다”며 “고객들이 원하는 맞춤 상품을 발굴해 질 좋은 상태로 지속가능하게 배송할 수 있는지가 관건이 될 것”이라고 말했다.]"
8,[내년 IPO 규모 30조원대...역대급을 넘어서는 역대급],https://www.khan.co.kr/economy/economy-general/article/202112291525001,2021.12.29 15:25,"[올해 역대 최대를 기록했던 증권 시장의 기업공개(IPO) 규모가 2022년에는 더욱 커질 것으로 예상된다. 예상 기업 가치가 수조원대에 이르는 대어급 기업들이 줄줄이 상장을 준비하고 있다., 29일 한국거래소에 따르면, 올해 유가증권시장(코스피)과 코스닥시장을 합친 IPO 공모금액은 20조8000억원으로 종전 최대 규모인 2010년의 10조2000억원을 두 배 이상 넘어섰다. 올해 코스피와 코스닥시장 IPO 공모금액은 각각 17조2000억원과 3조6000억원으로, 양쪽 모두 역대 최대를 기록했다. 특히 SKIET(2조2459억원, 5월), 카카오뱅크(2조5526억원, 7월), 크래프톤(4조3098억원, 8월) 등 대형 우량기업들이 코스피에 신규 상장한 것이 역대 최대 실적을 달성하는 데 기여했다. 신한금융투자에 따르면 올해 공모주 가운데 공모금액 1조원을 넘어서는 대어급들의 비중이 60%를 넘는다., 내년에는 IPO 규모가 30조원을 넘을 것이라는 전망이 나온다. 증권가에서는 내년 기업가치 1조원 이상 신규 상장 기업의 숫자가 올해(11개)를 넘어설 것으로 보고 있다., 최대 관심사는 내년 1월 상장을 추진 중인 LG에너지솔루션이다. LG에너지솔루션은 내년 1월11~12일 기관 투자자 수요예측을 통해 공모가를 산정한 뒤 18~19일 일반청약에 나설 예정이다. 희망 공모가는 주당 25만7000~30만원이다. 상장 후 시가총액 목표는 60조1380억~70조2000억원이다. 이는 현재 코스피 시총 기준으로 3~4위에 해당하는 수준이다. 공모금액은 10조9225억~12조7500억원으로, 역대 최대였던 2010년 삼성생명(4조8881억원)의 두 배가 넘는다., 현대자동차그룹 계열 건설사 현대엔지니어링과 현대중공업그룹 계열 정유사 현대오일뱅크도 내년 상장을 추진 중이다. 지난 10월 증권신고서를 제출하고 내년 2월 상장을 추진 중인 현대엔지니어링의 예상 기업가치는 최대 10조원으로 추산된다. 상장이 성공적으로 이뤄질 경우 시총 규모가 모회사 현대건설(5조원대)을 넘어서는 ‘건설 대장주’에 등극할 것으로 예상된다. 현대오일뱅크는 지난 13일 거래소에 상장 예비심사를 신청했으며, 상장 후 몸값은 최대 10조원으로 추산된다., 이커머스 업계에서는 쓱(SSG)닷컴, 마켓컬리, 오아시스마켓 등 ‘새벽 배송 빅3’가 상장에 나선다. 신세계 그룹 이커머스의 핵심인 쓱닷컴은 상장 후 목표 기업가치를 최대 10조원으로 잡고 있다. 마켓컬리를 운영하는 컬리는 지난 20일 홍콩계 사모펀드로부터 2500억원 규모의 프리IPO(상장 전 투자유치)에 성공했다. 기업가치는 최대 5조원으로 평가된다. 오아시스마켓은 상대적으로 인지도가 낮지만 이커머스 업계에서 몇 안 되는 흑자기업이다., 투자자들 사이에서는 올해 카카오뱅크와 카카오페이에 이어 내년에 카카오엔터테인먼트가 상장할 것이라는 기대감이 높다. 현대차증권은 카카오웹툰, 카카오스토리, 멜론 등을 운영하는 카카오엔터테인먼트가 내년 상반기에 예비심사를 청구한 뒤 하반기에 상장할 것으로 예측했다., 이 밖에 SK스퀘어 자회사인 토종 앱마켓 원스토어, CJ그룹의 국내 1위 헬스앤드뷰티(H&B) 스토어 CJ올리브영, 보안업체 SK쉴더스(옛 ADT캡스)가 내년 상장을 준비 중이다. 신창재 회장에 대한 소송으로 진행 여부가 불투명했던 교보생명도 전날 신 회장이 풋옵션 소송에서 승소하면서 IPO에 탄력이 붙을 전망이다.]"
9,[예상 가치 수조원대 기업 ‘줄줄이’…내년 IPO ‘신기록 행진’ 이어지나],https://www.khan.co.kr/economy/economy-general/article/202112292155015,2021.12.29 21:55,"[1월 상장 추진 LG에너지솔루션시총 목표 70조 ‘최대어’ 1순위현대엔지니어링 최대 10조 예상쓱닷컴 등 새벽배송 ‘빅3’도 나서, 올해 역대 최대를 기록했던 증권시장의 기업공개(IPO) 규모가 2022년에는 더욱 커질 것으로 예상된다. 예상 기업 가치가 수조원대에 이르는 대어급 기업들이 줄줄이 상장을 준비하고 있다., 29일 한국거래소에 따르면, 올해 유가증권시장(코스피)과 코스닥시장을 합친 IPO 공모금액은 20조8000억원으로 종전 최대 규모인 2010년의 10조2000억원을 두 배 이상 넘어섰다. 올해 코스피와 코스닥시장 IPO 공모금액은 각각 17조2000억원과 3조6000억원으로, 양쪽 모두 역대 최대를 기록했다., 내년에는 IPO 규모가 30조원을 넘을 것이라는 전망이 나온다. 증권가에서는 내년 기업가치 1조원 이상 신규 상장 기업의 숫자가 올해(11개)를 넘어설 것으로 보고 있다., 내년 1월 상장을 추진 중인 LG에너지솔루션이 최대어로 꼽힌다. LG에너지솔루션은 내년 1월11~12일 기관 투자자 수요예측을 통해 공모가를 산정한 뒤 18~19일 일반청약에 나설 예정이다. 희망 공모가는 주당 25만7000~30만원이다. 상장 후 시가총액 목표는 60조1380억~70조2000억원이다. 이는 현재 코스피 시총 기준으로 3~4위에 해당하는 수준이다. 공모금액은 10조9225억~12조7500억원으로, 역대 최대였던 2010년 삼성생명(4조8881억원)의 두 배가 넘는다., 현대자동차그룹 계열 건설사 현대엔지니어링과 현대중공업그룹 계열 정유사 현대오일뱅크도 내년 상장을 추진 중이다. 지난 10월 증권신고서를 제출하고 내년 2월 상장을 추진 중인 현대엔지니어링의 예상 기업가치는 최대 10조원으로 추산된다. 상장이 성공적으로 이뤄질 경우 시총 규모가 모회사 현대건설(5조원대)을 넘어서는 ‘건설 대장주’에 등극할 것으로 예상된다. 현대오일뱅크는 지난 13일 거래소에 상장 예비심사를 신청했다., 이커머스 업계도 줄줄이 상장을 준비 중이다. 쓱(SSG)닷컴, 마켓컬리, 오아시스마켓 등 ‘새벽 배송 빅3’가 상장에 나선다. 신세계그룹 이커머스의 핵심인 쓱닷컴은 상장 후 목표 기업가치를 최대 10조원으로 잡고 있다. 마켓컬리를 운영하는 컬리는 지난 20일 홍콩계 사모펀드로부터 2500억원 규모의 프리IPO(상장 전 투자유치)에 성공했다. 기업가치는 최대 5조원으로 평가된다. 오아시스마켓은 상대적으로 인지도가 낮지만 이커머스 업계에서 몇 안 되는 흑자기업이다., 올해 카카오뱅크와 카카오페이에 이어 내년에 카카오엔터테인먼트가 상장할 것이라는 전망도 나온다. 현대차증권은 카카오웹툰, 카카오스토리, 멜론 등을 운영하는 카카오엔터테인먼트가 내년 상반기에 예비심사를 청구한 뒤 하반기에 상장할 것으로 예측했다. 이밖에 SK스퀘어 자회사인 토종 앱마켓 원스토어, CJ그룹의 CJ올리브영, 보안업체 SK쉴더스(옛 ADT캡스), 교보생명 등이 상장을 준비 중이다.]"
