,titles,links,dates,contents
0,"[마켓컬리, SSG, 오아시스마켓 물류센터에 산업재해 ‘급증’]",https://www.khan.co.kr/national/national-general/article/202208151022001,2022.08.15 10:22,"[물류창고의 좁은 통로에서는 등 뒤로 지게차가 지나다녔다. 지게차의 지게 발을 피하면서 마켓컬리 생활물류센터 계약직 직원 A씨는 ‘이러다 한 번 다칠 수 있겠다’고 생각했다. 사람의 길과 지게차의 길이 선으로 구분돼 있지만, 상자와 장비가 빽빽이 들어찬 좁은 공간에서 동선은 자주 위태로워졌다. 지게 발에 다리가 걸려 다쳤다는 다른 직원의 이야기를 떠올리며 A씨는 가슴을 쓸어내렸다., 수도권 고객들이 앱으로 주문한 신선식품이 당일 새벽 문 앞에 도착하도록 돕는 게 A씨의 일이다. 식품을 신선하게 보관해주는 냉동고 입구 바닥엔 여름철에도 습기가 얼어붙어 있다. A씨는 “안전화를 신어도 미끄러져 넘어지는 사람이 많다”며 “잘못하면 크게 다칠 수 있어서 걱정된다”고 했다., 정신없이 분류하고 포장하고, 내려보내고 올려보내다 보면 늦은 밤이나 새벽에 퇴근하기 일쑤다. 직원마다 맡은 업무가 각자 다르지만 일이 몰리면 “결국 만능으로 다 해야 한다”. A씨는 주문이 폭증하는 추석이 벌써 두렵다. 같은 시간에 훨씬 많은 일을 처리해야 하기 때문이다. 물류센터에서는 일이 손에 익을 만하면 그만두는 사람들이 많아 정작 숙련된 직원은 부족하다. “어느 순간 못 버티고 다 사라지고…전체적으로 분위기가 빡세요.” 언젠가부터 A씨는 컨디션 조절이 잘 안 되기 시작했다고 했다., 코로나19로 비대면 시장이 커지면서 이커머스 새벽배송 업체들도 급성장했다. 소비자들은 매일 신선한 식품 등을 간편하게 배송받을 수 있는 서비스에 열광했다. 그러나 편리함의 뒷면에는 ‘현대판 막장’이라며 자조하는 노동자들의 한숨이 있다. 이들 업체가 운영하는 생활물류센터 노동자들의 곁엔 과로, 열악한 근무환경 등 사고 위험이 도사린다. 선두주자인 쿠팡에서 사고가 잦다 보니 다른 업체들은 상대적으로 주목을 덜 받지만 관련 통계 자료들은 다른 업체들도 마찬가지라고 말하고 있었다., 류호정 정의당 의원실이 근로복지공단에서 받은 ‘새벽배송 3사(마켓컬리·SSG닷컴·오아시스마켓) 산업재해 현황’을 보면, 이들 업체들의 산재는 2020년 이후 크게 증가했다. 코로나19로 대목을 맞은 업체들이 사업 확장을 위해 창고를 새로 세우고 인력을 늘린 시기와 맞물린다., 마켓컬리의 산재 신청은 2020년 9건에서 2021년 72건으로 크게 늘었다. 올해는 5월까지만 69건의 산재 신청이 접수됐다. 연 1~2건을 제외하면 대부분 산재로 인정됐다. 마켓컬리는 2021년 주문량 급증으로 김포 대형 물류센터를 추가로 열고 인력을 늘렸는데 이를 기점으로 산재도 함께 늘어났다. 마켓컬리 관계자는 “(인력 증가와 함께)2020년 10월부터 도급 형태로 운영하던 물류창고를 직접 운영으로 바꾸고, (타사와 달리)도급으로 쓰던 인력도 회사 직고용으로 대거 전환하면서 기존에는 도급사에 반영되던 산재가 당사에 반영된 영향도 크다”고 했다., SSG닷컴에서도 산재 신청은 2019년과 2020년 각각 12건씩이던 산재 발생이 2021년 약 2배 가까이(23건)로 뛰었다. SSG닷컴은 대형 물류센터가 아니라 ‘PP센터’에서 일어난 산재가 대부분이다. PP센터는 각지의 이마트에서 온라인 주문 당일배송을 처리하는 곳이다.  ‘새벽배송 업체 중  유일하게 흑자를 내는 기업’으로 잘 알려진 오아시스마켓에서는 2018~2020년 1~2건씩의 산재 신청만 있다가 2021년에는 15건으로 증가했다. 같은 해  오아시스마켓은 물류센터 직원을 40여 명에서 400여 명으로 늘렸다., 물류센터 특성상 위험한 작업환경에서 입는 부상이 산재의 대부분을 차지했다. 3사의 연간 산재 신고가 가장 많았던 2021년을 기준으로 마켓컬리는 72건 중 69건이 사고였고 질병은 3건 뿐이었다. 사고로 신고된 산재 중 68건이 승인을 받았다. 같은 기간 SSG닷컴의 23건(22건 승인)과 오아시스마켓의 15건(15건 승인)은 모두 사고였다., 부상의 유형은 골절·파열·삐임 등이 많았다. 2021년 산재 승인을 받은 마켓컬리 사고 68건 가운데 골절이 26건(38.2%)으로 비중이 가장 높았다. 삐임 19건, 타박상·진탕 10건, 파열·열상 7건 순이었다. SSG닷컴에서는 22건이 산재로 인정됐다. 골절과 파열·열상이 각각 7건(31.8%)이고 삐임이 6건, 타박상·진탕이 2건이었다. 오아시스마켓은 15건 가운데 골절과 파열·열상이 각각 5건(33.3%), 삐임이 2건, 타박상·진탕이 2건 승인됐다., 사고는 계속 늘어났지만 방지 대책 수립 속도는 더뎠다. 고용노동부가 2020년 벌인 산업안전보건근로감독에서 이커머스 업체들의 법 위반사항이 수두룩하게 적발됐다. 당시 고용노동부는 “코로나19로 인한 배송업무 급증으로 장시간 노동 등 과로와 안전이 우려된다”며 쿠팡 물류센터 5곳과 배송캠프 5곳, 마켓컬리 물류센터 1곳, SSG닷컴 물류센터 1곳에 대한 수시감독을 벌였다., 당시 마켓컬리의 장지물류센터 1곳에서만 위반사항 15건이 발견됐다. 기본적인 안전 관련 조치들이 미흡했고, 그중에는 큰 사고가 발생할 수 있는 요소도 있었다. 고용노동부는 컨베이어 회전축 덮개 미설치, 지게차와 근로자 혼재 작업 때 유도자 미배치, 낙하물 방지조치 미실시 등 7건에 대해 사법 조치했다. SSG닷컴의 김포 물류센터 1곳에 대한 감독에서는 동력문 안전조치와 컨베이어·양중기·감전 방호조치, 추락방지조치 미시행으로 총 19건이 사법처리됐다., 만성적인 과로도 건강을 위협했다. 감독 당시 고용노동부가 물류센터 종사자(포장·출고) 4390명을 대상으로 실시한 설문조사에서 성수기에 하루 8시간 이상 근무한다는 응답은 83.7%에 달했다. 이 중 ‘10~12시간 근무’도 11.1%로 적지 않았다. 성수기에 연장근로를 한다는 응답은 78.1%로 나타났다. 주 5일 연장근로를 한다는 응답이 20.0%로 가장 많았다., 주문량이 폭증하는 명절에는 극심한 과로에 시달린다. 배송시간을 맞춰야 하는 특성상 많은 물량을 ‘빨리빨리’ 쳐내야 하는 상황이 업무강도를 가중한다. 류호정 의원실이 고용노동부로부터 받은 노동자 B씨의 업무상 질병판정서를 보면, 마켓컬리의 한 물류센터에서 2020년 추석 명절선물세트 배송을 담당한 B씨는 쓰러지기 직전 4주간 주당 69시간을 일했다. 근로복지공단이 뇌혈관·심장 질병과 과로의 관련성을 판단하는 기준은 ‘주 64시간’이다. B씨의 당시 업무량은 평소보다 30% 많았다. 공단은 주·야간 교대업무와 냉장창고 상주 근무도 발병에 영향을 미쳤다고 봤다. 공단은 “업무상 과로와 업무부담 가중요인에 복합적으로 노출돼 업무와의 상당한 인과관계가 인정된다”며 B씨의 산재를 인정했다., 새벽배송 업체들은 안전사고 방지 대책을 꾸준히 마련하고 있다고 주장한다. 마켓컬리는 “2020년 고용노동부 감독 결과는 모두 개선했고, 최고안전책임자를 영입하고 전문기관의 컨설팅을 받는 등 개선을 진행했다”고 했다. SSG닷컴은 “안전보건관리 전담 조직을 강화하고 건강관리 프로그램 마련, 안전 관련 매뉴얼과 작업장 시설물 안전조치를 강화했다”며 “업계 최초로 국제표준규격 충족 인증을 받는 등 개선을 했고 매년 안전보건에 관한 예산을 편성하고 있다”고 밝혔다. 오아시스마켓은 “노동자를 직접 채용해 산재 보고를 매우 투명하게 진행하고 있고, 중상해가 1건도 발생하지 않는 등 안전에 신경쓰고 있다”고 했다., 전문가들은 노동인권의 관점에서 업계의 ‘체질’을 근본적으로 개선해야 한다고 지적한다. 비대면 열풍 속에 ‘신산업’으로 주목받으며 빠르게 성장한 만큼 그에 걸맞은 책임의식도 필요하다는 것이다. 전주희 서교인문사회연구실 연구원은 “빠른 배송과 온라인 시장은 거리두기를 가능하게 했다는 이유로 상찬받았지만, 이게 오히려 노동자를 저임금으로 쥐어짜게 만드는 동력으로 작용했다”며 “팽창하는 신산업의 특성상 경쟁사보다 우위를 점하기 위해 공격적인 투자가 이뤄졌지만 노동조건을 개선하는 쪽의 투자는 부족했다”고 했다., 대다수가 계약직·일용직인 고용구조도 안전에 악영향을 미친다. 전 연구원은 “계약직 일용직 노동자들은 산재에 대한 정보가 전혀 없고, 자신이 산재를 신청하면 불이익을 당할까 걱정하기도 한다”며 “특히 일용직이나 도급노동자는 다쳐서 쉬면 생계의 위험이 있어서 일을 계속하기 위해 아파도 참는다. 위험이 드러나지 않는 구조”라고 했다. 통계에 드러나지 않은 안전사고도 많을 수 있다는 것이다., 전 연구원은 또 “물류센터가 전반적으로 대형화되고 기계화되며 복잡해지는 경향이 있다. 단지 물건을 쌓아두는 창고가 아니라 포장과 입출고까지 종합적으로 하는데, 당일배송과 새벽배송이 강조되면서 기계장치들 사이에서 빠르게 일하려다 보니 부딪힘이나 끼임 등 사고가 많다”며 “노동안전은 안전사고를 가장 잘 아는 노동자들의 피드백이 가장 중요하다. 한번 개선하는 게 끝이 아니라, 산업안전보건위원회나 단체협약 등으로 노동자들의 의견을 계속 들을 수 있는 창구가 있어야 한다”고 했다., 류 의원은 “산재 증가와 노동관계법 위반 다수 적발은 노동자의 생명과 안전에 직결된 문제로, 전국의 물류센터가 노동인권 사각지대”라며 “정부가 노동안전보건 관점에서의 지속적인 관리·감독과 물류센터 화재 예방을 위한 정확한 원인 진단과 실효성 있는 종합 대책을 마련해야 한다”고 했다.]"
1,[IPO 혹한기 속 누가 웃을까…컬리·11번가·오아시스 상장 시동],https://www.khan.co.kr/economy/economy-general/article/202208291626011,2022.08.29 16:26,"[주요 e커머스 플랫폼이 기업공개(IPO) 레이스에 시동을 걸었다. 컬리를 시작으로 11번가와 오아시스마켓 등이 본격적인 상장 준비에 나선다. 투자금이 고갈되기 전 IPO를 미룰 수 없다는 판단에 따른 것으로, 상장 여부에 따라 e커머스의 옥석 가리기가 진행될 것으로 보인다., 29일 업계에 따르면 새벽배송 1위 업체 컬리는 지난 22일 한국거래소 유가증권시장 상장 예비심사를 통과해 증시 입성을 위한 첫 관문을 넘었다. 상장 예비심사를 받으면 6개월 이내 상장을 완료해야 한다. 컬리가 증시 입성에 성공하면 e커머스 업체로는 ‘국내 1호 상장’이 된다., 업계는 컬리의 몸값에 예의주시하고 있다. 컬리의 공모가와 흥행 여부에 따라 후발 주자들에 대한 평가가 달려있어서다. 컬리는 지난해 12월 프리IPO(상장 전 지분투자)를 유치하며 기업가치를 4조원으로 인정받았지만, 지금은 2조원대로 낮아졌다., 컬리가 낮아진 기업가치에도 상장을 하는 것은 새벽배송 지역 확장 등 추가 자금 확보가 시급하기 때문으로 풀이된다. 이를 위해 컬리는 화장품과 호텔 숙박권 등 비식품군을 확대해 영업손실을 줄이고, 오픈마켓·해외시장 진출 등으로 사업 다각화에 나섰다., 경쟁사인 오아시스마켓도 이르면 내달 코스닥 상장을 위한 상장 예비심사를 청구하고 IPO 절차를 밟는다. 시장이 평가하는 기업가치는 1조~1조2000억원 수준이다. 오아시스마켓은 매출 규모는 작아도 새벽배송 업계에서 유일하게 흑자를 내고 있다., 1세대 e커머스인 11번가는 지난 24일 IPO 대표 주관사로 한국투자증권과 골드만삭스를 선정하고 증시 입성을 위한 준비에 들어갔다. 11번가는 2018년 국민연금 등 주요 투자자들에게 투자를 받으며 ‘5년 내 상장’을 약속해 더 이상 상장을 미룰 수 없는 상황이다. 오픈마켓인 11번가는 매출 규모를 늘리기 위해 직매입 중심의 리테일 사업을 강화하고 아마존과 협력한 해외 직구 플랫폼 ‘아마존 글로벌 스토어’를 내세워 시장 점유율을 늘려나갈 계획이다., 이들 업체가 증시 침체에도 불구하고 상장에 나선 것은 시장 유동성 축소로 투자자들이 투자금 회수를 서두르는 가운데 경쟁사들과 접전을 벌이기 위한 추가 자금 확보가 절실하기 때문이다., 지난해 대표 주관사를 선정한 SSG닷컴의 경우 아직 상장 예비심사를 신청하지 않았다. 모회사인 이마트의 지원이 있는 데다, 증시 불확실성이 커진 만큼 당분간 상장 적기를 살피고 있는 것으로 보인다., 업계는 이번 상장 결과에 따라 e커머스 업계의 옥석가리기가 본격화할 것으로 전망한다. e커머스 관계자는 “시장 거품이 빠지고 있는 가운데 금리 인상 등의 대외변수로 상장이 어려워 투자 유치에 실패하는 플랫폼이 나타날 것”이라며 “손실을 줄여 흑자전환에 대한 가능성을 시장에 증명하지 못하면 생존의 기로에 몰릴 것”이라고 말했다.]"
2,"[이랜드·오아시스마켓 맞손 ""신선시장 판도 바꿀 것""]",https://www.khan.co.kr/economy/industry-trade/article/202206071719001,2022.06.07 17:19,"[올해 상장을 추진하는 새벽배송업체 오아시스마켓이 이랜드리테일을 전략적 투자자(SI)로 유치했다. 오아시스마켓은 이랜드리테일과 지분 및 사업, 운영 계약에 대한 사업제휴 협약을 체결했다고 7일 밝혔다., 사업제휴를 통해 이랜드리테일은 오아시스마켓 모회사인 지어소프트가 보유한 지분 3%(84만2062주)를 330억원에 인수했다. 주당 3만9189원으로 이를 반영하면 오아시스마켓의 기업가치는 약 1조1000억원이다., 양사는 시설투자 및 신사업 진출, 인수합병 등 대규모 사업 확장 시 최우선 파트너로 투자 등에 참여키로 했다. 이랜드리테일이 운영하는 식품전문 대형마트 킴스클럽 상품을 오아시스마켓의 온·오프라인 플랫폼에 판매하는 등 산지 개발과 신선상품 유통 시스템도 새로 구축한다., 이랜드리테일은 오아시스마켓의 온·오프라인 플랫폼을 활용해 신선식품 부문을 공격적으로 확대하고, 오아시스마켓은 이랜드 멤버십 회원과 30여개 킴스클럽 지점을 통한 마케팅을 기대하고 있다., 안준형 오아시스마켓 대표이사는 “이랜드리테일의 산지 신선상품을 오아시스마켓의 특화된 새벽배송 서비스로 제공해 온라인 신선식품 장보기 시장이 확대·재편될 것으로 기대된다”고 말했다., 윤성대 이랜드리테일 대표이사는 “양사의 파트너십 구축으로 국내 신선식품 시장의 판도가 바뀔 것”이라며 “고객과 접점을 늘려 고품질의 합리적인 신선식품을 손쉽게 경험할 수 있는 환경을 만들겠다”고 말했다.]"
3,[오아시스·여기어때 등 몸값 1조 유니콘 5개 늘어],https://www.khan.co.kr/economy/economy-general/article/202207211726001,2022.07.21 17:26,"[중소벤처기업부가 상반기 기업가치 1조원이 넘는 스타트업을 뜻하는 유니콘 기업이 23개로 집계됐다고 21일 밝혔다. 지난해 말보다 5개 늘어난 것으로, 반기 기준 역대 최대 규모다., 상반기에 새로 추가된 유니콘 기업은 여기어때 컴퍼니(여기어때 운영사), 오아시스(오아시스마켓 운영사), 메가존클라우드(클라우드 서비스), 시프트업(모바일 게임 개발), 아이지에이웍스(빅데이터 플랫폼)다., 이 중 아이지에이웍스는 씨비인사이트(CB Insights)의 유니콘 명단에도 올랐다. 씨비인사이트는 유니콘 현황을 파악하는 데 가장 자주 인용되는 매체다. 씨비인사이트 기준으로 한국 유니콘 기업 수는 미국(628개사), 중국(174개사), 인도(68개사) 등에 이어 세계 10위 수준이다., 중기부는 유니콘 기업이 작년 7개사가 집계된데 이어, 올해 상반기 5개사가 추가로 나온 것은 금리인상 등에 따른 세계적 기업가치 하락에도 불구하고 국내 벤처 생태계가 일군 성과라고 설명했다., 중기부는 “같은 기간 코스닥 시장에서 시가총액 1조원 이상 기업이 지난해 말 71개에서 올해 36개로 감소한 것에 비해 새로 탄생한 유니콘 기업 수가 반기 기준 역대 최고치를 기록한 것은 고무적”이라고 평가했다., 이영 중기부 장관은 “유니콘 성장이 더 가속화되도록 신기술 창업 촉진과 스타트업 글로벌화, 민간 투자금 유입 등에 역점을 두고 정책을 추진하겠다”고 말했다.]"
4,[직원 스마트폰 앱 ‘오아시스 루트’…집화·포장·배송 최적화 ‘흑자 루트’],https://www.khan.co.kr/economy/economy-general/article/202204102218025,2022.04.10 22:18,"[새벽 식품 배송업계서 유일 이익오아시스마켓 물류센터 가보니, 2018년 진출…작년 영업익 57억앱으로 장보기 시간 크게 줄이고무기계약직 고용해 숙련도 높여, 우리소비자생활협동조합으로 출발해 오프라인 매장을 운영하던 오아시스마켓(오아시스)은 2018년 새벽배송 진출 후에도 매년 흑자를 이어가고 있다. 오아시스는 지난해 매출 3570억원, 영업익 57억원을 달성했다. 매출 규모는 경쟁사에 비해 작지만 ‘레드오션’이 된 새벽배송 업계에서 유일하게 적자 없이 성장하고 있는 기업이다., 경쟁업체들은 1조원이 넘는 매출을 올려도 수천억원에 이르는 물류센터 자동화 투자 등으로 적자를 면치 못하고 있다. 이들은 “덩치가 커지면 수익성이 좋아지는 ‘계획된 적자’를 내고 있는 것”이라고 설명한다. 오아시스는 새로운 길을 택했다. 물류센터를 경쟁사들과 다르게 설계해 30억원가량의 ‘저비용’으로 해결했다. 통상 새벽배송은 각기 다른 물류센터에 있는 냉동·냉장·상온 식품이 중간 물류센터에 모이고, 이를 다시 분리포장해 소비자에게 배송하는 순서로 진행된다. 하지만 오아시스는 한 센터에서 식품을 모두 보관했다가 ‘합포장’을 한다., ■ 무기계약직 고용으로 숙련도 높여 , 지난 7일 방문한 경기 성남시 오아시스 물류센터 직원들은 팔에 스마트폰을 차고 있었다. 일반적으로 물류센터 직원들은 스마트폰을 센터 내로 반입하지 못한다고 한다. 오아시스 직원들은 애플리케이션(앱) ‘오아시스 루트(ROUTE)’로 주문을 확인하고 상품 위치가 뜬 곳으로 이동해 두부와 대파, 콩나물 등을 바구니에 담았다. 루트는 오아시스의 모회사인 지어소프트가 개발한 물류 프로그램이다. 오아시스가 새벽배송 업체 중 유일하게 흑자를 낼 수 있도록 만들어준 비결 중 하나다. 직원 한 사람이 바구니 15개, 15가구분의 주문이 담긴 대형 트레이를 움직이며 장보기를 하는데 시간은 10~30분가량밖에 걸리지 않는다., 오아시스는 직원 숙련도를 높이기 위해 무기계약직 형태로 고용한다고 설명했다. 모든 일처리가 앱에 기록돼 성과에 따라 월급이 올라간다. 최원석 오아시스 현장매니저(43)는 “직원들이 상품을 집품하기 위해 센터를 여기저기 헤매지 않도록 동선을 최적화했다”며 “합포장으로 자원낭비도 막고 배송의 효율성도 높일 수 있다”고 말했다., 일평균 운용 인력은 350여명으로 하루에 주문 2만~2만5000건을 처리한다. 센터의 넓이는 하역장까지 포함해 1만4426㎡(약 4364평)로 경쟁업체 물류센터에 비하면 절반 수준이지만 소화하는 주문량은 크게 차이가 나지 않는다. 오아시스는 지난해 루트로 미국 특허를 출원해 해외 물류시장 진출도 검토하고 있다., ■ 광고 없이 입소문으로 성장, 오아시스는 자본력을 동원한 대대적인 마케팅이나 스타 모델을 앞세운 광고 없이 입소문에 의존해 성장하고 있다. 수도권에 있는 57개 오프라인 매장이 온라인 매장을 홍보하며 제2의 물류센터 역할을 한다., 새벽배송으로 소화하지 못한 제품은 오프라인 매장에서 ‘땡처리’(재고떨이)해 재고폐기율 0%를 유지한다., 이 밖에 유기농·친환경 식품을 프리미엄 상품군이 아닌 ‘메인상품’으로 내세워 처음부터 차별화를 꾀했고, 생협의 노하우로 10여년간 직거래하는 산지 네트워크를 활용해 가격을 낮췄다. 이런 노력으로 재구매율이 90%를 웃돌며 충성고객이 느는 추세라고 오아시스는 설명했다., 낮은 인지도와 부족한 상품군, 수도권에 한정된 서비스는 오아시스가 풀어야 할 숙제다. 오아시스는 경기 의왕시와 울산 언양에 물류센터를 추가로 가동해 서비스 지역을 늘리고, 57개 오프라인 매장을 퀵커머스(즉시배송)용 물류센터로 활용할 방침이다.]"
