,titles,links,dates,contents
129,[제목 : [컬리] 요즘 누가 컬리하냐? 다들 쿠팡하지 ],https://www.38.co.kr/html/forum/board/?o=v&code=408480&no=214,2022-01-05,이런 쓰레기 어그로에겐 무관심이 답.가서 니네집 재활용이나 해 임마
130,[코멘트 : [컬리] 21년 매출 2조  가입자1000만명  너가 왜 걱정을하냐? ],https://www.38.co.kr/html/forum/board/?o=v&code=408480&no=215,2022-01-05,21년 매출 2조  가입자1000만명  너가 왜 걱정을하냐?올해매출 3조넘을건데
131,[제목 : [컬리] 요즘 누가 컬리하냐? 다들 쿠팡하지 ],https://www.38.co.kr/html/forum/board/?o=v&code=408480&no=216,2022-01-06,너도 많이 아프구나
132,[제목 : [컬리] 새벽배송 ],https://www.38.co.kr/html/forum/board/?o=v&code=408480&no=217,2022-01-17,새벽배송 컬리 얼마나 먹을게 있을까요물류창고가 필요없는 신개념 배송시스템 더맘마로 오세요지금 출발선상에 있어요
133,[제목 : [컬리] 전자증권 입고 되었네요!! ],https://www.38.co.kr/html/forum/board/?o=v&code=408480&no=218,2022-01-24,통일주권으로 변경완료되었네요.신청한 주식계좌로 주식입고 되었어요.이제 매수도시 계약자들 만나지 않고 쉽게 거래할 수 있겠어요. ㅎㅎ 좋은 가격 기대됩니다~
134,[코멘트 : [컬리] 곧 상장신청하겠군요 요즘 분위기도 좋은데 대박날듯 ],https://www.38.co.kr/html/forum/board/?o=v&code=408480&no=219,2022-01-24,곧 상장신청하겠군요 요즘 분위기도 좋은데 대박날듯
135,[제목 : [컬리] 뉴스좀 읽으세요 ],https://www.38.co.kr/html/forum/board/?o=v&code=408480&no=220,2022-01-24,요즘 컬리분위기 박살이구마반어법 이신가
136,[코멘트 : [컬리] 컬리 지속경영악화로 올해 상장 물건너 갔다고 뉴스떴 ],https://www.38.co.kr/html/forum/board/?o=v&code=408480&no=221,2022-01-25,컬리 지속경영악화로 올해 상장 물건너 갔다고 뉴스떴던데딴나라들 사시나..
137,[제목 : [컬리] 컬리의 주가향방은 이걸 보면 결정됩니다 ],https://www.38.co.kr/html/forum/board/?o=v&code=408480&no=222,2022-01-25,숨투자추천종목 다들 나락간거 아시죠?그 사람말 듣지 마세요저도 몇천 손해보고 손절쳤습니다이종목도 뻔합니다
138,[제목 : [컬리] 컬리 지속경영악화로 올해 상장 물건너 갔다고 뉴스떴 ],https://www.38.co.kr/html/forum/board/?o=v&code=408480&no=223,2022-01-25,상장 물건너 갔다는 뉴스요?어디한번 봅시다. 그 뉴스기사내용 올려보시지요.
139,[제목 : [컬리] 컬리의 주가향방은 이걸 보면 결정됩니다 ],https://www.38.co.kr/html/forum/board/?o=v&code=408480&no=224,2022-01-25,닥쳐라 !
140,[제목 : [컬리] 시장질서 교란행위로 금융감독원에 신고합니다. ],https://www.38.co.kr/html/forum/board/?o=v&code=408480&no=225,2022-01-25,풍문을 유포하거나 거짓으로 계책을 꾸며 수급상황이나 가격에 대하여 오해를 유발하거나 가격을 왜곡할 우려가 있는 행위는 자본시장법상 시장질서 교란행위로 금지됩니다. 담당부서 조사기획국 조사총괄팀  
141,[제목 : [컬리] 비상장 사는법은 알고? ],https://www.38.co.kr/html/forum/board/?o=v&code=408480&no=226,2022-01-26,내가 다 안타깝네 ㅠ
142,[제목 : [컬리] 구주매출 하나요? ],https://www.38.co.kr/html/forum/board/?o=v&code=408480&no=227,2022-01-27,현대엔지니어링 망했던데
143,[제목 : [컬리] 현대엔지니어링과는 차이가 있습니다. ],https://www.38.co.kr/html/forum/board/?o=v&code=408480&no=230,2022-01-27,"현대엔지니어링은 현대차그룹 오너를 위한 구주 매출 위주입니다. 현대엔지니어링 자체에 현금이 충분하여 공모로 인해 유입되는 자금에는 큰 관심이 없어 보입니다. 그러나 컬리는 공모를 통해 확보한 자금을 신규 투자에 활용하여 성장의 동력으로 삼으려고 하고 있습니다. 사실상 공모에 사운을 걸고 있습니다. 회사에서는 공모를 통해 최소한 5,000억 이상을 기대하고 있습니다. 따라서 컬리는 대부분 신주 모집으로 공모를 진행할 것으로 보입니다. 컬리에서 목표하는 자금을 확보하기 위해 공모가는 최소한 125,000원 이상이 될 것으로 예상합니다. 설이 지나고 바로 IPO 신청한다고 하네요."
144,[제목 : [컬리] 지금 살 수 있나요~? 주린이라 기업이 몰라서요 ],https://www.38.co.kr/html/forum/board/?o=v&code=408480&no=231,2022-01-27,여기서 개인간 거래 해야되는건가요? 
145,[제목 : [컬리] 전자증권 입고 되었네요!! ],https://www.38.co.kr/html/forum/board/?o=v&code=408480&no=232,2022-01-28,입고가 되셨나요? 아직 저는 입고가 안되고 며칠전 다시 무슨 서류 내라고 연락이 왔던데요?
146,[제목 : [컬리] 전자증권 입고되어서 증/플에서 거래가능해요~ ],https://www.38.co.kr/html/forum/board/?o=v&code=408480&no=234,2022-01-31,전자증권 입고되어서 증/플에서 거래가능해요~
147,[제목 : [컬리] 상장 앞두고 연이은 악재…마켓컬리 블랙리스트 의혹 검찰로 ],https://www.38.co.kr/html/forum/board/?o=v&code=408480&no=236,2022-02-06,"상장 앞두고 연이은 악재…마켓컬리 블랙리스트 의혹 검찰로[앵커]새벽배송으로 유명한 마켓컬리는 지난해 일용직을 대상으로 블랙리스트를 작성했다는 의혹을 받았습니다.그런데 최근 고용노동부가 해당 의혹이 사실이라며 검찰에 마켓컬리 기소 의견으로 넘겼다고 하는데요.상장 앞두고 악재가 이어지고 있습니다.자세한 내용 신윤철 기자 연결합니다.마켓컬리가 검찰에 송치됐다고요? [기자]그렇습니다.마켓컬리는 지난해 3월 이름과 주민등록번호, 연락처 등 일용직들의 개인정보를 담은 문건을 작성 후 채용 대행업체에 전달했습니다.그리고 이를 바탕으로 특정 일용직들에게 일감을 주지 않는 이른바 '블랙리스트'를 운용했다는 의혹을 받았습니다.노동문제연구소 해방 측은 이 의혹에 대해 마켓컬리와 최고경영자인 김슬아 대표이사를 고용노동부 측에 근로기준법 위반 혐의로 고발했는데요.노동부는 최근 마켓컬리의 근로기준법 위반 혐의 사실이 확인됐다며 문건 작성자와 마켓컬리 회사를 기소의견으로 검찰에 넘긴 겁니다.다만 노동부는 김슬아 대표에 대해서는 블랙리스트 작성에 관여한 근거를 찾지 못했다며 불기소 의견을 냈습니다. [앵커]그럼 마켓컬리는 어떤 처분을 받게 되는 건가요? [기자]근로기준법 제 40조는 ""누구든지 근로자의 취업을 방해할 목적으로 비밀 기호 또는 명부를 작성하면 안 된다""고 규정하고 있습니다.이를 위반 시 5년 이하 징역 또는 5천만 원 이하 벌금 처분이 내려집니다.최종 기소 여부는 검찰 조사에 따라 결정될 예정으로 마켓컬리 측은 ""조사 중인 사안으로 입장을 따로 밝히기는 어렵다""고 설명했는데요.​​​​​​​최근 판매장려금을 둘러싼 공정위 이슈 등 기업 윤리를 둘러싼 잇따른 논란이 상장을 앞둔 마켓 컬리에 발목을 잡는 것 아니냐는 우려가 커지고 있습니다.SBS Biz 신윤철입니다."
148,[코멘트 : [컬리] 숨투자 매수 가격에 매수했니? 숨투자가 얼마에 매수 ],https://www.38.co.kr/html/forum/board/?o=v&code=408480&no=237,2022-02-06,숨투자 매수 가격이 지금 보다 훨씬 낮음.
149,[제목 : [컬리] 컬리 매도물이 좀 있나요? ],https://www.38.co.kr/html/forum/board/?o=v&code=408480&no=238,2022-02-09,ㄴㅁ
150,[제목 : [컬리] 예심청구 언제하나요? ],https://www.38.co.kr/html/forum/board/?o=v&code=408480&no=239,2022-02-17,1월에 한다고 했는데 2월이 끝나가는데도 이야기가 없네요 ㅠ혹시 아시는분?
151,[제목 : [컬리] 더벨 기사 ],https://www.38.co.kr/html/forum/board/?o=v&code=408480&no=240,2022-02-17,16일 관련업계에 따르면 한국거래소는 마켓컬리 측에 상장예심청구에 앞서 경영권 보완 등을 요구했다.
152,[코멘트 : [컬리] 아마 30%이상으로 의결권 묶으라는거 같은데... 오래 ],https://www.38.co.kr/html/forum/board/?o=v&code=408480&no=241,2022-02-18,아마 30%이상으로 의결권 묶으라는거 같은데... 오래걸리나보군요 ㅠㅠ 빨리 청구해 ㅠ WCP도 밀렷네여 이러다가 오아시스랑 쓱에 밀리면ㅠㅠ
153,[제목 : [컬리] 상장은 후반기?? ],https://www.38.co.kr/html/forum/board/?o=v&code=408480&no=242,2022-02-23,김슬아는 돼지같이 욕심만 많아서 결국엔 상장은 후반기 이야기도 나오네약속을 이리 못지킬 거면 그냥 하질 마라설레발은
154,[코멘트 : [컬리] 이번주까지 청구안하면 어쩔수없이 하반기로 가야죠.. ],https://www.38.co.kr/html/forum/board/?o=v&code=408480&no=243,2022-02-24,이번주까지 청구안하면 어쩔수없이 하반기로 가야죠..ㅠㅠ예비심사 45일인데 요즘 더 걸린다고하구요
155,[제목 : [컬리] 컬리 후반기 ],https://www.38.co.kr/html/forum/board/?o=v&code=408480&no=244,2022-02-25,기관물량 8만5천원 던지는중 일반인들 좋다고9만~10만 사는중 
156,[코멘트 : [컬리] 기관 락 걸려 있어서 못던짐. ],https://www.38.co.kr/html/forum/board/?o=v&code=408480&no=246,2022-03-02,기관 락 걸려 있어서 못던짐.
157,[코멘트 : [컬리] 기관은 한둘이 아닌데... 만원 초반에 산사람들은 락 ],https://www.38.co.kr/html/forum/board/?o=v&code=408480&no=247,2022-03-07,기관은 한둘이 아닌데... 만원 초반에 산사람들은 락업 기간도 다풀렸을텐데..
158,[제목 : [컬리] 컬리 3월말 예심청구 ],https://www.38.co.kr/html/forum/board/?o=v&code=408480&no=248,2022-03-17,마켓컬리의 운영사인 컬리가 드디어 상장 절차에 돌입한다. 이달 주주총회를 진행하고 3월말 한국거래소에 상장 예비 심사를 청구해 기업공개(IPO) 절차를 본격화한다.11일 IB업계에 따르면 컬리가 이달 말 예비심사를 청구한다. 2021년 실적 결산을 바탕으로 청구에 돌입한다는 복안이다. 올 상반기 상장을 목표로 한국거래소에 1월 예비심사를 계획했던 컬리의 일정은 다소 지연됐지만 연내에는 상장할 수 있을 전망이다.그간 한국거래소는 컬리에 보호예수 기간을 통상 2년 길게는 3년까지 요구했다. 다수의 투자 유치를 통해 김슬아 컬리 대표의 지분율은 한 자릿수(2020년 기준 6.67%)로 낮아졌다. 거래소는 상장 이후 경영 안전성을 담보하기 위해 20% 이상 우호지분이 필요하다고 판단해 재무적투자자(FI)들이 지분을 팔지 못하도록 보호예수기간을 길게 설정하는 방안을 요구했다.대부분 FI들이 확약에 동의했지만 그 기간에 대해서는 회사와 FI간 이견이 발생했다. 하지만 3월말 예심청구를 위해 이견이 좁혀진 것으로 파악된다.
159,[제목 : [컬리] 외국넘들 엑싯이 목적인 상장 ],https://www.38.co.kr/html/forum/board/?o=v&code=408480&no=249,2022-03-28,밀어내기 매출일으키고 PSR  2적용해서 상장?완전 미친 짓이다이건 쿠팡보다 더 쓰레기 같은 사업구조인 회사다외국넘들이 어쩔수 없이 물린 종목을 왜 국민들 부담으로 떠넘기나?
160,[제목 : [컬리] 상장 청구 ],https://www.38.co.kr/html/forum/board/?o=v&code=408480&no=250,2022-03-28,4조밸류
161,[제목 : [컬리] 쿠팡보고 미장 간다고 난리치더만ㅋㅋ ],https://www.38.co.kr/html/forum/board/?o=v&code=408480&no=251,2022-03-29,결국 여기네ㅋㅋ
162,[코멘트 : [컬리] 거래소 사장이 상장해달라고 부탁한건 모르시나요? ],https://www.38.co.kr/html/forum/board/?o=v&code=408480&no=252,2022-03-29,거래소 사장이 상장해달라고 부탁한건 모르시나요?
163,[코멘트 : [컬리] 왜 그럼 우리가 아는 아마존이나 쿠팡은 PSR 3적용해 ],https://www.38.co.kr/html/forum/board/?o=v&code=408480&no=253,2022-03-29,왜 그럼 우리가 아는 아마존이나 쿠팡은 PSR 3적용해서 상장햇을까요..
164,[코멘트 : [컬리] 나같아도 의결권 배수로 인정해주는 미국갈듯 ],https://www.38.co.kr/html/forum/board/?o=v&code=408480&no=254,2022-03-29,나같아도 의결권 배수로 인정해주는 미국갈듯
165,[제목 : [컬리] 제2의 크래프톤 ],https://www.38.co.kr/html/forum/board/?o=v&code=408480&no=255,2022-03-29,대주주 지분 6% 나머지 VC 엑시트 물량
166,[제목 : [컬리] 컬리가 아마존이나 쿠팡이랑 같냐? 아마존 이란다 ㅋㅋㅋ ],https://www.38.co.kr/html/forum/board/?o=v&code=408480&no=256,2022-03-29,그럼 미국에서 상장했어야지모지리 그리고 비교할게 없어서 아마존 하고 하냐?너 컬리에서 물건 시켜보고 그런말해라요즘같이 농산물파동오면 컬리는 그냥 망이여
167,[코멘트 : [컬리] 둘다 이커머스이고 대부분 이커머스 상장을 PSR 기준 ],https://www.38.co.kr/html/forum/board/?o=v&code=408480&no=257,2022-03-29,둘다 이커머스이고 대부분 이커머스 상장을 PSR 기준으로하는데 당연히 평균내는데 쿠팡아마존 넣겟지;;미국상장할라고햇는데 거래소가 국내상장해달라고 사정해서 해줫는데;; 농산물 파동오면 가격연동해서 올리는데 개꿀아니냐 어차피 미리 매입해서 하는거라 수익성 ㅅㅌㅊ
168,[제목 : [컬리] 외국넘들 엑싯이 목적인 상장 ],https://www.38.co.kr/html/forum/board/?o=v&code=408480&no=258,2022-03-29,FI들로부터 2~3년간 Exit 안하기로 동의를 받았습니다
169,"[제목 : [컬리] 기업개요에 경상이익, 순이익이 잘 못 기재된 것 같은데 바로 잡아 주시요. ]",https://www.38.co.kr/html/forum/board/?o=v&code=408480&no=259,2022-03-29,38 관계자님아.
170,[제목 : [컬리] 에고 또 누굴 멕이려고 이런 종목 상장시키나 ],https://www.38.co.kr/html/forum/board/?o=v&code=408480&no=261,2022-03-30,흑자도 못내는 오로지 매출만 뻥튀기시키려고 혈안이 되있는데맘대로는 안되고..온통 엑시트할 생각밖에 없는 이런 회사들...잘될까
171,"[제목 : [컬리] 진짜 이해가 안가는게,, ]",https://www.38.co.kr/html/forum/board/?o=v&code=408480&no=262,2022-03-30,돈 안될거 같으면 안사면되지 여기와서 짖는애들 왜케 많냐? 컬리 손실이 어쩌고 하는 애들은 주총에는 참석하고 상황 파악하고 짖는거냐?다른건 모르겠고 적자드립하는 애들은 재무제표 공부좀하고
172,[제목 : [컬리] 컬리 대표는 상장전에 자신있으면 자사주식을 사라 ],https://www.38.co.kr/html/forum/board/?o=v&code=408480&no=263,2022-03-30,개미들한테 컬리주식 넘기기전에 대표부터 주식 매입해야한다대표의 쥐꼬리 지분과 적자회사를 개미한테 떠넘기려는 목적같다vc 들도 엑시트에 혈안되어서 ......가관이다
173,[제목 : [컬리] 컬리 정리 한번 해봅니다. ],https://www.38.co.kr/html/forum/board/?o=v&code=408480&no=264,2022-03-30,"1. 중국 자본이라고 하는 것에 대해...우선 대표이사 김슬아의 지분은 6.67% 뿐이 되지 않습니다.SCC Growth 가 3.12%지분을 소유하고 있으며 해당 회사는 미국의 유명한 투자회산인 세쿼이아캐피탈의 중국 현지화 펀드의 투자 일부 입니다.그럼 세쿼이아캐피탈에 대한 이해부터 해야 하며, 해당 캐피탈은 세계에서 가장 유명한 VC입니다.최근 상장한 KTB네트워크, 스톤브릿지벤처스와 같이 성장이 예상되는 기업에 투자하고 엠엔에이와 상장을 토해 수익을 올리는 기업입니다.세쿼이아캐피탈이 투자한 회사는 애플, 오라클, 시스코, 야후, 구글, 유투브, 줌, 인스타그램등... 수도 없이 많습니다. 또한 성공률과 수익률도 매우 컸습니다.세쿼이아캐피탈차이나와 세쿼이아캐피탈은 다만 여러 이슈로 결별 가능성도 높게 예측되고 있습니다.세쿼이아캐피탈차이나는 2019,20,21년 3번에 걸쳐 컬리에 투자하였고, 그결과 최대주주가 되었습니다. 우리가 잘아는 비바리퍼블리카에도 2번의 투자를 한 회사이기도 하며, 중국 글로벌 투자회사인 힐하우스캐피탈도 10% 지분을 가지고 있습니다.기존 투자자들이 많은 상황이고, 김슬아대표의 우호지분 회사도 많은 상황에서 해당 회사의 내용도 모르고 무작정 중국자본이라고 이야기하는것자체가 무지의 안드로메다임을 자칭하는 것으로 생각 됩니다.  2. 손실관련20년도 2,224억원의 적자에서 21년도 1조2700억원의 적자로 1조이상 손실이 확대 되었습니다.  여기서 우리가 유심히 봐야할 부분은 해당 적자 중 상당수는 RCPS로 배정받은 주식을 상장을 위해 보통주로 전환되면서 발생한 파생상품평가손실 부분입니다. 제가 생각하기에는 대략 1조원가량이 그부분에 해당하지 않을까? 생각이 듭니다. 즉, 부채는 죽이고, 자본에 영향을 끼친 부분으로 실질적인 현금상의 손실이 아니기 때문에 오히려 21년도 적자폭은 20년도와 유사하다고 생각듭니다.  또한, 매출액 대비 손실율을 감안하였을 경우를 생각해본다면 21년도에 컬리가 얼마나 성장했는지? 확실히 보여주는 부분임을 알수있을꺼라 봅니다.  특히, 신규투자로 발생한 감가상각비까지 고려해서 생각한다면, 컬리가 현금상에 이익이 날수도 있겠다. 라는 생각도 들기도 합니다.3. 경쟁사가장강력한 경쟁자는 SSG닷컴입니다. 아마 컬리로 인해 SSG닷컴의 규모도 자연스럽게 결정될것입니다. 하지만,,, SSG닷컴은 자본으로 밀어 붙이는 회사로써 새벽배송의 첫주자인 컬리와 구성등을 놓고 보았을때, 솔찍히 많은 차이가 나는 부분은 사이트에 접속해서 주문해보시면 압니다.두번째는 오아시스 입니다.  오아시스 주주분들께는 죄송합니다만, 오아시스는 컬리와 견줄만한 깜이 되지 못합니다. 성장성이나 비전의 부재가 상당이 크게 다가올것이며, 문제는 만약 컬리와 같이 공격적인 물류센터에 투자가 가능할것인가? 라는 부분으로 저 개인소견으로는 사이즈의 속도전에서 결국 밀리지 않겠느냐? 라는 생각이 많이듭니다.투자는 여러사람들의 결정사항입니다. 물론 회사가 좋고 나쁨을 떠나 주가는 변동성이 워낙크기 때문에, 무조건 돈번다는 의미도 아닙니다.   하지만, 찌라시 기사와 어이없는 댓글등을 보면, 제대로 알고 말하는 사람들인가? 라는 의구심이 많이 들기도 합니다.2주전에 9만원찍고 지난주 주총 이후 부터 잘가고 있는 부분이 보입니다만, 더욱 웃긴건 컬리를 쿠팡과 비교하는것 자체가 좀 어이없다고 생각하는 사람중에 한명입니다.  쿠팡 주가가 저렇게 꺽인 이유는? 실적? 시장상황? 여러가지가 있을수 있겠으나, 대주주지분에 대한 락 부분의 부재로 인해 솔찍히 도덕성의 문제로 인해 발생했다고 생각 됩니다.  어차피 김슬아 대표는 앞으로 일정기간 동안 주식 팔고 싶어도 팔지도 못합니다. 오히려 컬리 투자자에게는 금번 락물량이 상당한 메리트로 자리 잡을것으로 보이며, 장투도 나쁘지 않다고 생각 됩니다.컬리 투자자분들 성투하시길 빕니다.그럼 전~~~ 이만~"
174,[제목 : [컬리] 컬리 정리 한번 해봅니다. ],https://www.38.co.kr/html/forum/board/?o=v&code=408480&no=265,2022-03-30,"이분이 적은 글이 가장 객관적이고 정확하네요.다른건 모르겠고, 21년 손실사유에 대해 적으신거 수치까지 거의 정확하네요,,그런데 개x들도 모르는 것들이 손실이 어쩌고 이러는거보면,,진짜 귀싸대기 여러대 갈기고 싶은 심정입니다."
175,[제목 : [컬리] 지분논란을 해결할수 있는 단 하나의 회사.. ],https://www.38.co.kr/html/forum/board/?o=v&code=408480&no=266,2022-03-30,"롯..데...현금성자산 2조이상있고, 지분 상당부분 가져오면 오버행이슈 해소 되고 경영권 매각이나 유지까지 가능한 킹데아닙니까?"
176,[코멘트 : [컬리] ㅇㄱㄹㅇ ㅋㅋㅋㅋㅋㅋㅋㅋㅋㅋㅋㅋㅋㅋㅋㅋㅋㅋㅋㅋ ],https://www.38.co.kr/html/forum/board/?o=v&code=408480&no=267,2022-03-30,ㅇㄱㄹㅇ ㅋㅋㅋㅋㅋㅋㅋㅋㅋㅋㅋㅋㅋㅋㅋㅋㅋㅋㅋㅋㅋㅋㅋㅋ
177,[코멘트 : [컬리] 너같으면 후질구레한 전셋집에 집주인이 들어와달라면 ],https://www.38.co.kr/html/forum/board/?o=v&code=408480&no=268,2022-03-30,"너같으면 후질구레한 전셋집에 집주인이 들어와달라면 그냥 들어가냐?안간게 아니라 못간거야. 거래량 안나오면 쉽게 퇴출되는데가 거기고,컬리같은 적자 성장주들이 롤러코스터를 타고 있는 시즌인거고,그만큼 외국 투자자본이 움직이지 않을것 같으니까 못간거라고정신승리하는건 알겠는데 ㅋㅋ아무 메리트가 없는 전세집에 집주인이 들어와달라고 들어가는게 말이나 되냐 도대체 ㅋㅋ 하도 헛소리라 거들어본다"
178,[제목 : [컬리] 컬리 할인쿠폰 ],https://www.38.co.kr/html/forum/board/?o=v&code=408480&no=269,2022-03-30,"상장전이라 인위적으로 매출을 늘리기위해서 계속 할인쿠폰을 주는것같은 느낌?.  초기에는 자주 주문해먹었는데 점점 살게없어지는것같음. 수시로 20프로가량할인쿠폰 그리고 2만원사면 무료배송쿠폰이 자주오는데, 이 쿠폰에 익숙해진사람들은 상장후 이게 끊기면 어떻게될까도 생각해볼필요도있을듯해요"
179,[제목 : [컬리] 논문을써라 ],https://www.38.co.kr/html/forum/board/?o=v&code=408480&no=270,2022-03-30,여기에서 부정적인 잣대로 디스하는 인간들은누가봐도 주주가 아닌것같은데 시간이 많으면이곳에서 손가락 놀리지말고 그시간에 운동이라도하시길 바랍니다
180,[제목 : [컬리] 뭐야 상장신청했네? ],https://www.38.co.kr/html/forum/board/?o=v&code=408480&no=271,2022-03-31,딱보니 설겆이 작업 들어간거구만
181,[제목 : [컬리] 주요 주주 ],https://www.38.co.kr/html/forum/board/?o=v&code=408480&no=272,2022-04-01,1위 중공 (세콰이어캐피탈 차이나)   12.87%2위 중공 (힐하우스 캐피탈)          11.89%3위 소련 (DST 글로벌)               10.17%4위 홍콩 (애스펙스 캐피탈)           8.48%5위 미국 (오일러 캐피탈)             6.73%6위 한국 (김슬아)                    5.75%...
182,[제목 : [컬리] 컬리 상장은 부페한 생선을 신선했던(?) 식품이라고 속여 파는 거다 ],https://www.38.co.kr/html/forum/board/?o=v&code=408480&no=273,2022-04-02,식자재배달?롯데마트에서 시키면 포장도 깨끗하고 다른 공산품도 다 살수 있는데 뭐러 컬리같은데 시키냐?근데 어떻게 하면 영업손실 2천억이 가능한거냐
183,[제목 : [컬리] 컬리 상장은 부페한 생선을 신선했던(?) 식품이라고 속여 파는 거다 ],https://www.38.co.kr/html/forum/board/?o=v&code=408480&no=274,2022-04-04,밑에 자세히 분석한 글 참고하고넌 그냥 롯데마트가서 사먹어끝.
184,[제목 : [컬리] 논문을써라 ],https://www.38.co.kr/html/forum/board/?o=v&code=408480&no=275,2022-04-04,여기 부정적인 글 쓰는애들 헬스장 끊을 돈없음.그냥 뒷산가서 소리나 지르라고 하는게 현실적으로 맞을듯 싶네요
185,[제목 : [컬리] 모라임이란자  단단히 물렸구나 ],https://www.38.co.kr/html/forum/board/?o=v&code=408480&no=276,2022-04-05,ㅋㅋ 분석한걸 읽어 보란다분석한거 보고 주식 샀나보내한심한 사람외국인들이 투자하니 냅다 샀구나ㅋㅋ
186,[제목 : [컬리] 1조원 손실이 우선주를 부채로 인식함에 따른 회계상의 착시??? ],https://www.38.co.kr/html/forum/board/?o=v&code=408480&no=277,2022-04-05,회계 아는 사람은 알거다상장만하면 외국넘들 최소1조원이상 이익이란거다결국 선량한 국민이 봐야되는 손실이 최소1조원이란 거다컬리의 상장목적은 딱하나다. 외국넘들 먹튀자금 마련
187,[제목 : [컬리] 모라임이란자  단단히 물렸구나 ],https://www.38.co.kr/html/forum/board/?o=v&code=408480&no=279,2022-04-06,"나 안물렸어 멍청아,, 그냥 팩트로 말해야지 개소리 싸지르니 말하는거다"
188,[코멘트 : [컬리] IFRS가 부채이고 K-gaap이 자본 아닐까요 ],https://www.38.co.kr/html/forum/board/?o=v&code=408480&no=280,2022-04-06,IFRS가 부채이고 K-gaap이 자본 아닐까요
189,[제목 : [컬리] 말하는 꼬라지가 물렸네 ㅋㅋ ],https://www.38.co.kr/html/forum/board/?o=v&code=408480&no=281,2022-04-07,팩트를 따지자면 그냥 쓰레기 적자회사야과거에도 적자 지금도 적자 앞으로는 큰 적자
190,[제목 : [컬리] 대동단결 ],https://www.38.co.kr/html/forum/board/?o=v&code=408480&no=282,2022-04-08,기존 VC들이 개미들한테 떠넘길 준비중청약 패쓰해야함
